{
  "$schema": "https://json-schema.org/draft/2020-12/schema",
  "$id": "https://sat-sim.local/schemas/golden-set-v27.schema.json",
  "title": "V27 Agent Golden Set",
  "type": "object",
  "required": [
    "schema_version",
    "cases"
  ],
  "properties": {
    "schema_version": {
      "const": "v27.agent-golden-set.v1"
    },
    "description": {
      "type": "string"
    },
    "case_count": {
      "type": "integer",
      "minimum": 1
    },
    "category_counts": {
      "type": "object",
      "additionalProperties": {
        "type": "integer",
        "minimum": 0
      }
    },
    "cases": {
      "type": "array",
      "minItems": 1,
      "items": {
        "type": "object",
        "required": [
          "case_id",
          "category",
          "input_kind",
          "expected"
        ],
        "properties": {
          "case_id": {
            "type": "string",
            "minLength": 1
          },
          "category": {
            "type": "string",
            "minLength": 1
          },
          "input_kind": {
            "enum": [
              "natural_language",
              "form",
              "task_spec",
              "patch"
            ]
          },
          "input": {
            "type": "object"
          },
          "backend": {
            "type": "string"
          },
          "execute": {
            "type": "boolean"
          },
          "expected": {
            "type": "object",
            "required": [
              "accept"
            ],
            "properties": {
              "accept": {
                "type": "boolean"
              }
            },
            "additionalProperties": true
          }
        },
        "additionalProperties": true
      }
    }
  },
  "additionalProperties": true
}
