{
  "schema_version": "v27.agent-golden-set.v1",
  "description": "Formal V27 Golden Set for TaskSpec, routing, ownership, rejection and claim safety.",
  "case_count": 140,
  "category_counts": {
    "component_scenarios": 25,
    "subsystem_scenarios": 30,
    "whole_spacecraft_scenarios": 30,
    "coupled_multi_output": 15,
    "invalid_boundary": 20,
    "ambiguous_conflict_missing": 10,
    "adversarial_claim": 10
  },
  "cases": [
    {
      "case_id": "component_01",
      "category": "component_scenarios",
      "input_kind": "form",
      "input": {
        "form": {
          "task_id": "golden_001_component_battery_v1",
          "capability_id": "component.battery.v1",
          "level": "component",
          "duration_s": 360.0,
          "sample_s": 30.0,
          "outputs": {
            "qoi": [
              "qoi.eps.battery.initial_soc"
            ]
          }
        }
      },
      "expected": {
        "accept": true,
        "capability_id": "component.battery.v1",
        "level": "component",
        "qoi": [
          "qoi.eps.battery.initial_soc"
        ],
        "validation_result": "PASS",
        "run_bundle_integrity_ok": true
      },
      "execute": true
    },
    {
      "case_id": "component_02",
      "category": "component_scenarios",
      "input_kind": "form",
      "input": {
        "form": {
          "task_id": "golden_002_component_data_queue_v1",
          "capability_id": "component.data_queue.v1",
          "level": "component",
          "duration_s": 420.0,
          "sample_s": 30.0,
          "outputs": {
            "qoi": [
              "qoi.comm.data_queue.final_queue_bits"
            ]
          }
        }
      },
      "expected": {
        "accept": true,
        "capability_id": "component.data_queue.v1",
        "level": "component",
        "qoi": [
          "qoi.comm.data_queue.final_queue_bits"
        ]
      }
    },
    {
      "case_id": "component_03",
      "category": "component_scenarios",
      "input_kind": "form",
      "input": {
        "form": {
          "task_id": "golden_003_component_heater_v1",
          "capability_id": "component.heater.v1",
          "level": "component",
          "duration_s": 480.0,
          "sample_s": 30.0,
          "outputs": {
            "qoi": [
              "qoi.*"
            ]
          }
        }
      },
      "expected": {
        "accept": true,
        "capability_id": "component.heater.v1",
        "level": "component",
        "qoi": [
          "qoi.*"
        ]
      }
    },
    {
      "case_id": "component_04",
      "category": "component_scenarios",
      "input_kind": "form",
      "input": {
        "form": {
          "task_id": "golden_004_component_link_budget_v1",
          "capability_id": "component.link_budget.v1",
          "level": "component",
          "duration_s": 300.0,
          "sample_s": 30.0,
          "outputs": {
            "qoi": [
              "qoi.*"
            ]
          }
        }
      },
      "expected": {
        "accept": true,
        "capability_id": "component.link_budget.v1",
        "level": "component",
        "qoi": [
          "qoi.*"
        ]
      }
    },
    {
      "case_id": "component_05",
      "category": "component_scenarios",
      "input_kind": "form",
      "input": {
        "form": {
          "task_id": "golden_005_component_onboard_storage_v1",
          "capability_id": "component.onboard_storage.v1",
          "level": "component",
          "duration_s": 360.0,
          "sample_s": 30.0,
          "outputs": {
            "qoi": [
              "qoi.comm.storage.final_stored_bits"
            ]
          }
        }
      },
      "expected": {
        "accept": true,
        "capability_id": "component.onboard_storage.v1",
        "level": "component",
        "qoi": [
          "qoi.comm.storage.final_stored_bits"
        ]
      }
    },
    {
      "case_id": "component_06",
      "category": "component_scenarios",
      "input_kind": "form",
      "input": {
        "form": {
          "task_id": "golden_006_component_payload_v1",
          "capability_id": "component.payload.v1",
          "level": "component",
          "duration_s": 420.0,
          "sample_s": 30.0,
          "outputs": {
            "qoi": [
              "qoi.*"
            ]
          }
        }
      },
      "expected": {
        "accept": true,
        "capability_id": "component.payload.v1",
        "level": "component",
        "qoi": [
          "qoi.*"
        ]
      }
    },
    {
      "case_id": "component_07",
      "category": "component_scenarios",
      "input_kind": "form",
      "input": {
        "form": {
          "task_id": "golden_007_component_payload_sensor_v1",
          "capability_id": "component.payload_sensor.v1",
          "level": "component",
          "duration_s": 480.0,
          "sample_s": 30.0,
          "outputs": {
            "qoi": [
              "qoi.*"
            ]
          }
        }
      },
      "expected": {
        "accept": true,
        "capability_id": "component.payload_sensor.v1",
        "level": "component",
        "qoi": [
          "qoi.*"
        ]
      }
    },
    {
      "case_id": "component_08",
      "category": "component_scenarios",
      "input_kind": "form",
      "input": {
        "form": {
          "task_id": "golden_008_component_power_sink_v1",
          "capability_id": "component.power_sink.v1",
          "level": "component",
          "duration_s": 300.0,
          "sample_s": 30.0,
          "outputs": {
            "qoi": [
              "qoi.*"
            ]
          }
        }
      },
      "expected": {
        "accept": true,
        "capability_id": "component.power_sink.v1",
        "level": "component",
        "qoi": [
          "qoi.*"
        ]
      }
    },
    {
      "case_id": "component_09",
      "category": "component_scenarios",
      "input_kind": "form",
      "input": {
        "form": {
          "task_id": "golden_009_component_radiator_v1",
          "capability_id": "component.radiator.v1",
          "level": "component",
          "duration_s": 360.0,
          "sample_s": 30.0,
          "outputs": {
            "qoi": [
              "qoi.*"
            ]
          }
        }
      },
      "expected": {
        "accept": true,
        "capability_id": "component.radiator.v1",
        "level": "component",
        "qoi": [
          "qoi.*"
        ]
      }
    },
    {
      "case_id": "component_10",
      "category": "component_scenarios",
      "input_kind": "form",
      "input": {
        "form": {
          "task_id": "golden_010_component_reaction_wheel_v1",
          "capability_id": "component.reaction_wheel.v1",
          "level": "component",
          "duration_s": 420.0,
          "sample_s": 30.0,
          "outputs": {
            "qoi": [
              "qoi.adcs.reaction_wheel.initial_speed_rad_s_0"
            ]
          }
        }
      },
      "expected": {
        "accept": true,
        "capability_id": "component.reaction_wheel.v1",
        "level": "component",
        "qoi": [
          "qoi.adcs.reaction_wheel.initial_speed_rad_s_0"
        ]
      }
    },
    {
      "case_id": "component_11",
      "category": "component_scenarios",
      "input_kind": "form",
      "input": {
        "form": {
          "task_id": "golden_011_component_solar_panel_v1",
          "capability_id": "component.solar_panel.v1",
          "level": "component",
          "duration_s": 480.0,
          "sample_s": 30.0,
          "outputs": {
            "qoi": [
              "eps.solar.energy_generated_wh"
            ]
          }
        }
      },
      "expected": {
        "accept": true,
        "capability_id": "component.solar_panel.v1",
        "level": "component",
        "qoi": [
          "eps.solar.energy_generated_wh"
        ]
      }
    },
    {
      "case_id": "component_12",
      "category": "component_scenarios",
      "input_kind": "form",
      "input": {
        "form": {
          "task_id": "golden_012_component_thermal_node_v1",
          "capability_id": "component.thermal_node.v1",
          "level": "component",
          "duration_s": 300.0,
          "sample_s": 30.0,
          "outputs": {
            "qoi": [
              "qoi.*"
            ]
          }
        }
      },
      "expected": {
        "accept": true,
        "capability_id": "component.thermal_node.v1",
        "level": "component",
        "qoi": [
          "qoi.*"
        ]
      }
    },
    {
      "case_id": "component_13",
      "category": "component_scenarios",
      "input_kind": "form",
      "input": {
        "form": {
          "task_id": "golden_013_component_battery_v1",
          "capability_id": "component.battery.v1",
          "level": "component",
          "duration_s": 360.0,
          "sample_s": 30.0,
          "outputs": {
            "qoi": [
              "qoi.eps.battery.initial_soc"
            ]
          }
        }
      },
      "expected": {
        "accept": true,
        "capability_id": "component.battery.v1",
        "level": "component",
        "qoi": [
          "qoi.eps.battery.initial_soc"
        ]
      }
    },
    {
      "case_id": "component_14",
      "category": "component_scenarios",
      "input_kind": "form",
      "input": {
        "form": {
          "task_id": "golden_014_component_data_queue_v1",
          "capability_id": "component.data_queue.v1",
          "level": "component",
          "duration_s": 420.0,
          "sample_s": 30.0,
          "outputs": {
            "qoi": [
              "qoi.comm.data_queue.final_queue_bits"
            ]
          }
        }
      },
      "expected": {
        "accept": true,
        "capability_id": "component.data_queue.v1",
        "level": "component",
        "qoi": [
          "qoi.comm.data_queue.final_queue_bits"
        ]
      }
    },
    {